{
  "schema_version": "master-topic-pack-v1",
  "topic_id": "instrumentation_system_design_basis_codes_standards_specification_deviation_management",
  "title_ko": "계측제어 시스템 설계기준, Code·Standard·Specification 및 Deviation 관리",
  "revision": 1,
  "legacy_topic_pack": {
    "source_root": "rubrics/topic_packs/instrumentation_system_design_basis_codes_standards_specification_deviation_management",
    "source_files": {
      "fact_anchor": "rubrics/topic_packs/instrumentation_system_design_basis_codes_standards_specification_deviation_management/fact_anchor.json",
      "logic_check": "rubrics/topic_packs/instrumentation_system_design_basis_codes_standards_specification_deviation_management/logic_check.json",
      "model_answer": "rubrics/topic_packs/instrumentation_system_design_basis_codes_standards_specification_deviation_management/model_answer.json",
      "topic_importance": "rubrics/topic_packs/instrumentation_system_design_basis_codes_standards_specification_deviation_management/topic_importance.json"
    }
  },
  "projections": {
    "grading": {
      "projection_id": "grading-projection-v1",
      "authority": "existing_topic_pack",
      "source_keys": [
        "fact_anchor",
        "logic_check",
        "model_answer",
        "topic_importance"
      ]
    },
    "training": {
      "projection_id": "training-projection-v1",
      "content_sources": [
        "fact_anchor",
        "model_answer",
        "topic_importance"
      ],
      "daily_target": 2
    },
    "diagnosis": {
      "projection_id": "diagnosis-projection-v1",
      "content_sources": [
        "fact_anchor",
        "logic_check",
        "model_answer"
      ],
      "dimensions": [
        "format",
        "content",
        "reasoning",
        "application",
        "verification"
      ]
    }
  },
  "sources": [],
  "source_update_policy": {
    "mode": "proposal_only",
    "approval_required": true
  }
}
