{
  "schema_version": "master-topic-pack-v1",
  "topic_id": "lqr_optimal_state_feedback_riccati_weighting_design",
  "title_ko": "LQR 최적 상태피드백·Riccati 방정식·가중치 설계",
  "revision": 1,
  "legacy_topic_pack": {
    "source_root": "rubrics/topic_packs/lqr_optimal_state_feedback_riccati_weighting_design",
    "source_files": {
      "fact_anchor": "rubrics/topic_packs/lqr_optimal_state_feedback_riccati_weighting_design/fact_anchor.json",
      "logic_check": "rubrics/topic_packs/lqr_optimal_state_feedback_riccati_weighting_design/logic_check.json",
      "model_answer": "rubrics/topic_packs/lqr_optimal_state_feedback_riccati_weighting_design/model_answer.json",
      "topic_importance": "rubrics/topic_packs/lqr_optimal_state_feedback_riccati_weighting_design/topic_importance.json"
    }
  },
  "projections": {
    "grading": {
      "projection_id": "grading-projection-v1",
      "authority": "existing_topic_pack",
      "source_keys": [
        "fact_anchor",
        "logic_check",
        "model_answer",
        "topic_importance"
      ]
    },
    "training": {
      "projection_id": "training-projection-v1",
      "content_sources": [
        "fact_anchor",
        "model_answer",
        "topic_importance"
      ],
      "daily_target": 2
    },
    "diagnosis": {
      "projection_id": "diagnosis-projection-v1",
      "content_sources": [
        "fact_anchor",
        "logic_check",
        "model_answer"
      ],
      "dimensions": [
        "format",
        "content",
        "reasoning",
        "application",
        "verification"
      ]
    }
  },
  "sources": [],
  "source_update_policy": {
    "mode": "proposal_only",
    "approval_required": true
  }
}
