{
  "schema_version": "master-topic-pack-v1",
  "topic_id": "hazop_lopa_ipl_risk_reduction_sil_target_allocation",
  "title_ko": "HAZOP·LOPA·독립보호계층을 이용한 목표 SIL 결정 및 SIF 할당",
  "revision": 1,
  "legacy_topic_pack": {
    "source_root": "rubrics/topic_packs/hazop_lopa_ipl_risk_reduction_sil_target_allocation",
    "source_files": {
      "fact_anchor": "rubrics/topic_packs/hazop_lopa_ipl_risk_reduction_sil_target_allocation/fact_anchor.json",
      "logic_check": "rubrics/topic_packs/hazop_lopa_ipl_risk_reduction_sil_target_allocation/logic_check.json",
      "model_answer": "rubrics/topic_packs/hazop_lopa_ipl_risk_reduction_sil_target_allocation/model_answer.json",
      "topic_importance": "rubrics/topic_packs/hazop_lopa_ipl_risk_reduction_sil_target_allocation/topic_importance.json",
      "question_demand_axes": "rubrics/topic_packs/hazop_lopa_ipl_risk_reduction_sil_target_allocation/question_demand_axes.json"
    }
  },
  "projections": {
    "grading": {
      "projection_id": "grading-projection-v1",
      "authority": "existing_topic_pack",
      "source_keys": [
        "fact_anchor",
        "logic_check",
        "model_answer",
        "topic_importance"
      ]
    },
    "training": {
      "projection_id": "training-projection-v1",
      "content_sources": [
        "fact_anchor",
        "model_answer",
        "topic_importance"
      ],
      "daily_target": 2
    },
    "diagnosis": {
      "projection_id": "diagnosis-projection-v1",
      "content_sources": [
        "fact_anchor",
        "logic_check",
        "model_answer"
      ],
      "dimensions": [
        "format",
        "content",
        "reasoning",
        "application",
        "verification"
      ]
    }
  },
  "sources": [],
  "source_update_policy": {
    "mode": "proposal_only",
    "approval_required": true
  }
}
