{
  "schema_version": "master-topic-pack-v1",
  "topic_id": "control_valve_maintenance_inspection_troubleshooting_overhaul_reassembly_testing",
  "title_ko": "제어밸브 정비·점검·고장진단·분해정비·재조립 및 시험",
  "revision": 1,
  "legacy_topic_pack": {
    "source_root": "rubrics/topic_packs/control_valve_maintenance_inspection_troubleshooting_overhaul_reassembly_testing",
    "source_files": {
      "fact_anchor": "rubrics/topic_packs/control_valve_maintenance_inspection_troubleshooting_overhaul_reassembly_testing/fact_anchor.json",
      "logic_check": "rubrics/topic_packs/control_valve_maintenance_inspection_troubleshooting_overhaul_reassembly_testing/logic_check.json",
      "model_answer": "rubrics/topic_packs/control_valve_maintenance_inspection_troubleshooting_overhaul_reassembly_testing/model_answer.json",
      "topic_importance": "rubrics/topic_packs/control_valve_maintenance_inspection_troubleshooting_overhaul_reassembly_testing/topic_importance.json"
    }
  },
  "projections": {
    "grading": {
      "projection_id": "grading-projection-v1",
      "authority": "existing_topic_pack",
      "source_keys": [
        "fact_anchor",
        "logic_check",
        "model_answer",
        "topic_importance"
      ]
    },
    "training": {
      "projection_id": "training-projection-v1",
      "content_sources": [
        "fact_anchor",
        "model_answer",
        "topic_importance"
      ],
      "daily_target": 2
    },
    "diagnosis": {
      "projection_id": "diagnosis-projection-v1",
      "content_sources": [
        "fact_anchor",
        "logic_check",
        "model_answer"
      ],
      "dimensions": [
        "format",
        "content",
        "reasoning",
        "application",
        "verification"
      ]
    }
  },
  "sources": [],
  "source_update_policy": {
    "mode": "proposal_only",
    "approval_required": true
  }
}
