{
  "schema_version": "master-topic-pack-v1",
  "topic_id": "control_software_project_engineering_documents_fat_sat_commissioning_acceptance",
  "title_ko": "제어 소프트웨어 프로젝트, 설계문서, FAT·SAT·시운전 및 인수",
  "revision": 1,
  "legacy_topic_pack": {
    "source_root": "rubrics/topic_packs/control_software_project_engineering_documents_fat_sat_commissioning_acceptance",
    "source_files": {
      "fact_anchor": "rubrics/topic_packs/control_software_project_engineering_documents_fat_sat_commissioning_acceptance/fact_anchor.json",
      "logic_check": "rubrics/topic_packs/control_software_project_engineering_documents_fat_sat_commissioning_acceptance/logic_check.json",
      "model_answer": "rubrics/topic_packs/control_software_project_engineering_documents_fat_sat_commissioning_acceptance/model_answer.json",
      "topic_importance": "rubrics/topic_packs/control_software_project_engineering_documents_fat_sat_commissioning_acceptance/topic_importance.json"
    }
  },
  "projections": {
    "grading": {
      "projection_id": "grading-projection-v1",
      "authority": "existing_topic_pack",
      "source_keys": [
        "fact_anchor",
        "logic_check",
        "model_answer",
        "topic_importance"
      ]
    },
    "training": {
      "projection_id": "training-projection-v1",
      "content_sources": [
        "fact_anchor",
        "model_answer",
        "topic_importance"
      ],
      "daily_target": 2
    },
    "diagnosis": {
      "projection_id": "diagnosis-projection-v1",
      "content_sources": [
        "fact_anchor",
        "logic_check",
        "model_answer"
      ],
      "dimensions": [
        "format",
        "content",
        "reasoning",
        "application",
        "verification"
      ]
    }
  },
  "sources": [],
  "source_update_policy": {
    "mode": "proposal_only",
    "approval_required": true
  }
}
