{
  "schema_version": "master-topic-pack-v1",
  "topic_id": "emerging_technology_quantum_computing_instrumentation_control_applications_readiness_limits",
  "title_ko": "양자컴퓨팅 등 신기술의 계측제어 적용·성숙도·한계 평가",
  "revision": 1,
  "legacy_topic_pack": {
    "source_root": "rubrics/topic_packs/emerging_technology_quantum_computing_instrumentation_control_applications_readiness_limits",
    "source_files": {
      "fact_anchor": "rubrics/topic_packs/emerging_technology_quantum_computing_instrumentation_control_applications_readiness_limits/fact_anchor.json",
      "logic_check": "rubrics/topic_packs/emerging_technology_quantum_computing_instrumentation_control_applications_readiness_limits/logic_check.json",
      "model_answer": "rubrics/topic_packs/emerging_technology_quantum_computing_instrumentation_control_applications_readiness_limits/model_answer.json",
      "topic_importance": "rubrics/topic_packs/emerging_technology_quantum_computing_instrumentation_control_applications_readiness_limits/topic_importance.json"
    }
  },
  "projections": {
    "grading": {
      "projection_id": "grading-projection-v1",
      "authority": "existing_topic_pack",
      "source_keys": [
        "fact_anchor",
        "logic_check",
        "model_answer",
        "topic_importance"
      ]
    },
    "training": {
      "projection_id": "training-projection-v1",
      "content_sources": [
        "fact_anchor",
        "model_answer",
        "topic_importance"
      ],
      "daily_target": 2
    },
    "diagnosis": {
      "projection_id": "diagnosis-projection-v1",
      "content_sources": [
        "fact_anchor",
        "logic_check",
        "model_answer"
      ],
      "dimensions": [
        "format",
        "content",
        "reasoning",
        "application",
        "verification"
      ]
    }
  },
  "sources": [],
  "source_update_policy": {
    "mode": "proposal_only",
    "approval_required": true
  }
}
