{
  "schema_version": "master-topic-pack-v1",
  "topic_id": "piezoelectric_sensor_charge_amplifier_dynamic_force_pressure_acceleration",
  "title_ko": "압전식 센서와 전하 증폭기",
  "revision": 1,
  "legacy_topic_pack": {
    "source_root": "rubrics/topic_packs/piezoelectric_sensor_charge_amplifier_dynamic_force_pressure_acceleration",
    "source_files": {
      "fact_anchor": "rubrics/topic_packs/piezoelectric_sensor_charge_amplifier_dynamic_force_pressure_acceleration/fact_anchor.json",
      "logic_check": "rubrics/topic_packs/piezoelectric_sensor_charge_amplifier_dynamic_force_pressure_acceleration/logic_check.json",
      "model_answer": "rubrics/topic_packs/piezoelectric_sensor_charge_amplifier_dynamic_force_pressure_acceleration/model_answer.json",
      "topic_importance": "rubrics/topic_packs/piezoelectric_sensor_charge_amplifier_dynamic_force_pressure_acceleration/topic_importance.json"
    }
  },
  "projections": {
    "grading": { "projection_id": "grading-projection-v1", "authority": "existing_topic_pack", "source_keys": ["fact_anchor", "logic_check", "model_answer", "topic_importance"] },
    "training": { "projection_id": "training-projection-v1", "content_sources": ["fact_anchor", "model_answer", "topic_importance"], "daily_target": 2 },
    "diagnosis": { "projection_id": "diagnosis-projection-v1", "content_sources": ["fact_anchor", "logic_check", "model_answer"], "dimensions": ["format", "content", "reasoning", "application", "verification"] }
  },
  "sources": [],
  "source_update_policy": { "mode": "proposal_only", "approval_required": true }
}
